529685078,U 兔,力荐,2012-05-09,1,这部基本是我最喜欢的，一下子就吸引住了，丰富的人物，神奇而又不显得胡扯的故事，将一个有趣的大陆上有趣的人们的面孔逐渐展开。故事写得自然流畅，作者简直像是多人附体，每个人物的言行心理都非常符合个性，语言也生动有趣充满睿智（而不是童话式的套路，人们的话一看都是硬拼上去的）。冰原狼雄鹿狮子这些家徽也够气势并符合家族气质。每一章节的故事都在一个很恰当的点戛然而止，这么复杂的线索却能理得顺畅从容，更重要的是要一波三折，实在很见功力。忘记这一本有没有重要人物的死去，反正死得干脆，实在让人震惊。我在被剧透的情况下依然能看得到这样的效果，可见这本书是多么厉害。这本书英文版于1996年问世，到2005年才有中译。现在还没译出来第五本，真是让人急死了~
504959893,和尚,还行,2012-03-21,70,书好在真实真诚，读着读着勾起了当年许多回忆，但是九把刀这文字功底，比起我豆瓣一些友邻都差了不少。
526283912,茱萝纪,较差,2012-04-30,19,为毛评分这么高啊，又没高潮又不够有趣，平淡还了无生趣，与其他优秀的青春小说或是青春影视相比，这个都弱爆了~
459122580,公元1874,还行,2011-11-18,30,不知为什么，老是看不进这书，大概是过分台湾化的对白和场景无法令我有代入感吧。
459006994,桃桃淘电影,null,2011-11-18,13,一辈子都说不烂的青春与回忆，有点期待这个电影了
594233441,Nothing,力荐,2012-10-28,2,让别人看一场他的热血青春，确实有着樱木花道的热血啊！
499404037,然犀,推荐,2012-02-23,3,很愉快的阅读。少年柯景腾活在自己的热血与想象中，时常幼稚，关键时刻自卑，但他一直懂得珍惜感恩每一点别人的善意与帮助
477850912,某水,力荐,2012-01-04,1,"""什么都不懂的年纪，曾经最掏心所以最开心"""
469470959,恪,还行,2011-12-20,5,青春，在彻头彻尾的平淡中悄然离去…不要和我说我还年轻，我只是一个机器而已…一个半成品却当成品使用的机器而已…
461855928,小岩井,还行,2011-11-25,4,我只能说，还行，看到一半就很艰难了，结局也没让我很感动，但是比较期待电影
431361979,阿梦,推荐,2011-11-20,1,[ 阅读之前因了Q喜欢所以对本书期望颇高，整体感觉青春、不作，对青春期少男少女情愫拿捏到位。 ] 喜欢有许多种方式，在一起或不在一起，并不妨碍爱情纵横发展。为了能够被爱，能够与Ta平起平坐更甚成为Ta的依靠，我们总是不懈余力且心甘情愿的改变着自己。纵然最后我们没能走到一起，或者分开，我们变成比从前更好的自己，这难道不是一种快慰与收获！可是，心里怎么还是会有一股如墨一般淡开的遗憾。
457512463,Dissipator。,推荐,2011-11-15,0,昨天晚上失眠x到四c多。今天读完一声叹息……
523872279,Yuyii,推荐,2012-04-23,0,我们总是在这个世界上，寻找跟我们“连结”的另一个人。连结的方式有很多种，有的连结是一种陪伴，有的连结是一种互相取暖，有的连结则是一种淡淡的默契。
457112103,[已注销],力荐,2011-11-13,0,「如果爱情不能使一个人变成平常不会出现的那一个人，那么爱情的魔力也未免太小了。」―― 深得我心。
447606341,小晨,还行,2011-10-18,0,可能我老了，可能我还不够老。这故事没有太多共鸣。也或许这个是专门写给男人去回忆青春的。
459533932,一个小标点,还行,2011-11-19,0,网上找不到电影，就把小说很快翻完，没他的演讲好玩，看起来也没电影好玩。他自己是个有意思的人。“喜欢喜欢别人时发光的自己”
467820145,Ejing,推荐,2011-12-11,0,还不错啦
355747451,筷喜旺,推荐,2011-06-20,1,读着读着就会想起蔡智恒来着。啊，好真实的青春！！！
211505833,易水寒,推荐,2010-02-02,0,那些年 我们也追求过一个女孩
485010987,阿Pe,还行,2012-01-21,6,不知不觉看了通宵，还是电影能接受一些。看完书后，对沈佳宜的印象从一个很纯的女孩子变成了一个很“不怎么样”的女生。
462666924,大-燕-威-王,力荐,2011-11-27,0,坦率地讲，不喜欢女主，太能“作”了，很不好伺候。但很喜欢充满热血的作者，敢于去爱比自己强大的女孩，在热烈的仰慕当中让自己发光发热，变得精彩――他是个勇士，不但深爱着女主，也同时深爱着恋爱中的自己。这才是青春，这才是爱情，这才是生活中的强者！！！当岁月流逝，铅华散尽，值得纪念的，其实是那十几年真正的青春时光。
81407693,everythinbagel,力荐,2012-03-11,0,"很孩子气
很好看"
458001633,大头绿豆,还行,2011-11-15,0,想起十几年前看《第一次的亲密接触》。热血和暧昧有些些牵强，吐槽也不尽高级，但青涩和热烈的感情，我和作者一样庆幸曾经拥有。
459796216,[已注销],力荐,2012-02-11,0,一石激起千层浪
397251841,Dr. ChaLove,推荐,2011-05-31,0,你是否也还记得那一段美好，也许写给你的信早扔掉。但也许这样才好。曾少你的，你已在别处都得到。
431361802,Q。,力荐,2011-08-30,1,一口气读完，十分流畅，如此真实感人，嬉皮笑脸的九把刀把所有人都带到了那一个只属于自己的青春年少，即使当时是苦涩难过，但是现在回味起来都不会有一丝后悔。这篇小说不再是小说，而是一部好看的真实记录。此刻，你是否还记得曾经用力追过的Ta？是不是也有个一辈子都不曾亲到的Ta？是不是心中一直为那个Ta保留一个专属位置？
428673309,王大根,还行,2011-08-23,0,这么多年过去，我已经忘了剧情。
476758309,蜜朵荔,还行,2012-01-01,0,在等热水器烧开洗澡的时间里 看完九把刀的那些年的小说 几个男生一同聊喜欢的沈佳仪的设定 让我想起蓝色大门里的林月珍 张士豪的篮球 张士豪的球鞋 张士豪的周记 张士豪喝过的保特瓶 蓝色的青春里我们都有过一个或不止一个的心仪对象 虽然闭上眼睛看不见自己 但是却可以看见你
551502128,Pirouette,还行,2012-07-03,1,就介？就这点噱头？那老子写一写可以拍五部那些年了。
465542967,林介咪,null,2011-12-05,0,呵呵，读完了又，中文阅读水平再创高峰
459270460,francesca,null,2011-11-19,1,当此故事愈加脱缰走向覆水难收才让你知道青春是对着一张墙就可以惊天动地的美好，和骑上了单车看着机车绝尘而去追也追不上却幸福感爆棚的记忆中盛夏
249715518,jiaon,力荐,2010-05-11,1,真美。
498776916,游牧人・芳汀,null,2012-06-01,2,我相信写这本书的时候九把刀是一个真诚的大男孩，但是后来他将这份成长的回忆拍成了电影，而且不得不考虑在其中加入商业卖点和流行元素之时，这份曾经被时间埋没的诚意和动人已然被完全湮没。
452006246,五色全味,还行,2011-10-30,0,第一次读九把刀，尝试在看过电影之。其实我不太喜欢这样的文笔，不过我读到了作者的真诚
458948983,王小亚,还行,2013-08-30,0,之前看他演讲时就在想沈佳仪是双鱼吧。。。起码也是个有强双鱼成分的，后来看提到的生日礼物是2月23日，果然。。。
534495143,飞林沙,力荐,2012-05-21,1,看着看着，哭了出来
457973700,lavi,还行,2011-11-17,1,很通俗的文字 没有狗血的情节 开始看看就放下了 但是最后还是满感动的 果然安达充还是出现了
459141582,Ms.A扑柔,还行,2011-11-18,0,……还不如看他的北大演讲稿
658767060,好姑娘老妖,还行,2013-03-25,2,挺好的一小说，可是，完全无法理解它红成那样的理由。相比之下，电影拍得更好一些。
494320117,木儿,推荐,2012-02-11,1,青春是一场潮水
523282135,伯爵在城堡,较差,2012-04-22,1,真心觉得这故事很无聊。
469005832,裸踝,还行,2011-12-13,0,《那些年，我们一起追女孩》其实是一个非常适合中学生阅读的小说，九把刀的文笔也就是个给中学生看的水平。原著以一种很孩子的口吻、很舒缓的节奏讲故事，挺热血的，没有那么多赤裸裸少儿不宜的情节。而电影更像是九把刀的另一部作品《阴茎》与其的合体，重口味+小清新，适合大学生看多一点。另外，电影里删去的一个小说中的重要人物李小华，我觉得挺可惜的。
490556937,吵,还行,2012-02-02,0,九把刀确实应该拍电影，文字都是有画面感的，反而读着没意思了。
394579990,芝麻酱,推荐,2011-06-01,0,飚着泪两次坐过站。其实只有最后十分之一是好看的，却一定要看过前面的十分之九。那一年，青春如潮水般淹没我们，如今看着又快被潮水擦去的脚印，亲爱的，我们都已振翅高飞了
461887380,hushlight,还行,2011-12-17,0,青涩热血校园故事，我还是更喜欢九把刀写的黑暗小说。又及：告白这种东西有毛用啊
234722843,代号273,较差,2012-02-05,1,字里行间透着不认真创作的味道，敷衍了事得有些过分
464145949,拔刀诀,力荐,2011-12-07,0,这本书居然大陆出过，倒…………
409733666,蚂蚁没问题,还行,2011-09-01,0,当年对暗恋的男生也大约只使用过在他面前故意大声说笑希望能引起注意这种十分中二的招数，看别人这么洪烈的追人被追，多少还是有点嫉妒啊。
461155364,离庭鹿,推荐,2011-11-23,0,于20111123。呃，PDF，用手机一天读完了...
559955507,chuchu,推荐,2012-07-24,0,热血的青春呀！
460204041,一位热心的网友,推荐,2011-11-21,0,-________-''呃，谁能告诉我我为什么要看言情小说
487151160,夏虫不语冰,推荐,2012-01-26,0,最感动的吻新郎原来是电影的   原创情节。小说和电影还是挺不一样的。
456208969,大星,推荐,2011-11-11,0,你以为多么平凡俗烂小清新啊！但实际上就非常真实啊！
494684240,Abigail,null,2012-02-12,0,看到自己的影子
470009431,NO,推荐,2011-12-21,0,"想到《初恋这件小事》的小水，因为一个人的出现，整个世界都被点亮。然后，那么幸福又紧张地地朝着更优秀更美好的自己飞奔向前。《那些年》也一样洋溢着如此浓郁的青春气息，很冲劲很纯粹。""you light up my world."" ""you are my inspiration."" ""you are the apple of my eyes""不同版本的话，却是同样的真诚和值得守护的情怀吧：）"
481613912,elimu,推荐,2012-01-22,0,txt 九把刀的文字风格不是很喜欢……但是后来想想有种他在给你讲故事的感觉 干！
467052131,koala,推荐,2012-01-05,0,在西安时读完的，那些因爱而闪闪发亮的时间。
328161894,EUPHORIAa,推荐,2010-12-18,0,想起一些事情
276889197,WZ,null,2010-09-07,0,和後青春期的有似到耶！好期待影作品呢！而且我看哭了 上n掉眼I很糗耶！
484148338,杉九,力荐,2012-01-18,0,当年很少看书，看了这一本，还是电子版的好像，好像还没看完，但是呢，当时虽然看的很草率但是是真心喜欢，当年看的时候还没有现在这么火，现在是真的火啊
412329591,茶切刀食菠萝包,力荐,2013-01-14,0,当年高一，看这本书，又哭又笑，看完各种感慨各种青春
473947775,Kreuzberg,还行,2011-12-26,0,高中时候看的，无感。
82059397,浅。,推荐,2012-01-14,0,每个人都有这样的经历。不经意听到某一首歌，某一段旋律，就会瞬间回忆起某段时光里的自己。或高中，或大学，或看见坐在自己座位旁，那张用粉笔划下白线的青涩脸庞。
440539782,兔牙小姐,null,2011-09-28,0,@pageone
474370191,沙漠里的一条腿,还行,2011-12-27,0,话说我真是受不了台湾网络小说的文笔，真的是 很幼稚。即使我觉得这电影还不错，但是书实在看不下去。文字的感觉对我是个很重要的东西啊
271413905,药丸,推荐,2010-07-16,0,喜欢上对的人时身上会发光，青春里有这样友达以上恋人未满的八年时光已足够精彩。
477972629,柯柯柯尼,力荐,2012-01-04,0,喜欢一个人的时候，整个人都会发着光。
458760857,以太,还行,2011-11-17,0,如果和这个相比，我的中学历程简直可以算是史诗。从资优生到自暴自弃，从烂好人到主动犯贱。加之古惑仔流行的大环境，鸡婆的欧巴桑，白痴得打劫一次就进监狱的傻逼。相比被砍出肠子流血的青春。这真是弱爆了！
458145956,[已注销],还行,2012-05-07,0,好水。。。
453792933,犬系少女刘七七,推荐,2011-11-04,0,想看电影啊
475604654,一二,力荐,2011-12-30,0,最简单的文字 最真实的回忆
469527218,神威,还行,2011-12-15,0,吐槽不能，此书本身平平无奇，属于刀大笔下既无特色也无剧情的涂鸦之作，很多人却是因为这本书才认识刀大，真让人有历尽辛苦不如无心插柳的沮丧心情
516908211,芥 末,推荐,2012-04-05,0,很纳闷李小华为什么不在电影中出现呢？
493008690,霏昀,较差,2012-02-08,0,虎躯一震！
480529696,Angela,还行,2012-01-10,0,和电影简直就是两个故事。
468273860,边城不浪,推荐,2011-12-11,0,在他们没变成面目可憎的中年男人之前……
458956489,白日美人_S,还行,2011-12-03,0,不懂。算了吧。
477256403,witecross,还行,2012-01-02,0,没有结果的恋爱，只要开了花，颜色就是灿烂的。见识了那道灿烂，我的青春，再也无悔。
488164054,Maurice Moss,推荐,2012-02-03,0,还不错
468846301,阿垃垃圾花,力荐,2011-12-13,0,可能在成长的过程中，我们曾经刻画地那些或轰轰烈烈或平平淡淡的日子终究成为一副触及不到的浮雕横亘在整个生命过程里。我们无法再重来一次，只能用尽自己各种方式使它依旧鲜活在自己的记忆里，待到真正能和它说再见时也能微笑着挥挥手。沈佳仪的婚礼上，一伙都曾将那个女孩作为最珍贵秘密的男孩儿们也都长大了，没人哭，没人闹，没人沮丧，他们举杯只为自己那充实度过的青春。我想，大概也只有青春能有如此大的力量了。
462535395,紫苏バジル,推荐,2011-11-27,0,站在故事的结局写青春的开始。开花不结果又有什么？是鱼就一定要游泳？最美的地方莫过于，最后我们都没有追到那个女孩。
484909292,凝淇,推荐,2012-01-20,0,跟电影还是有很多不同，好吧，相比我更喜欢电影@。@
460805361,夏Simeon。,推荐,2011-11-22,0,看完电影再看小说，果然还是原著比较好看。读书时候的细节全都记不清了，甚至走在路上碰见老同学也想不起来名字，果然是感情淡薄到连回忆录都无法写出来的人啊，笑。
447563988,芥末蘸酱,推荐,2011-10-18,0,"还未学习怎么记念从前,便发觉要懂得拥抱明天.祝福都当诺言以后不知会点.大个当然会善变."
452956411,轩辕白圭,还行,2011-12-28,0,"敬，我们的青春。其实，这是一则似乎看了开头，便可以知道结尾的故事，却依然牵着读者的心，跟着作者一起重温热血、荒唐的年少青春，“喜欢一个人，会让自己发光”，然后在一个优雅美丽的姑娘面前，彻底慌了神，将读书作为追求女孩子的伟大事业。这样的一条路，坚持走了八年，很像是所有人青春故事的汇编版，那个“沈佳仪”一样的女孩子在我们的青春岁月中，耀眼至今，似乎一切都像是发生在昨日。当喜欢一个人的想法，绞尽脑汁地想要告诉对方时，自己会发现自己前所未有地变成一个白痴，只知道傻呵呵地傻坐在桌前，幻想着告白成功会有鲜花洒落、音乐响起的画面，抑或告白失败后一个人在深夜的街头漫无目的地彳亍游弋，泪水划过脸颊时和自己说是风沙吹了眼。
谢谢“沈佳仪”，那些年，我们一起追的女孩，让我们在平淡无奇的青春里，做个闪闪发光的白痴。"
450423550,七十三,推荐,2011-10-26,0,结局很伤感啊！错过了就不可能在一起了，也就是一辈子的好朋友了。“我也喜欢喜欢着你的我”。
467814103,少陵野老大哭着,还行,2011-12-11,0,绝对有四星以上的。只是我个人非常不喜欢故事的后半【从沈佳仪对柯景腾表白开始】，这个故事如果要完全打动我，那么沈佳仪绝不能爱过柯景腾。
454956812,Frankel,推荐,2011-11-07,0,和电影一样精彩，还是那句话说的好：两情相悦，相对无言，最销魂！
522551057,[已注销],推荐,2012-04-20,0,我怎么啥都看过。。。书一般，多一颗星给九把刀的有趣和好记性。
619046162,Sarcophagus,还行,2012-12-21,0,读时尚在彼时彼地，仿佛已很遥远。结局的文字终于感动。读毕拉开窗帘，正是夕阳西下，残红无限，滑板青年掠过温暖的街面，黑夜最长的日子渐行渐远。
466327834,傅踢踢,推荐,2011-12-07,0,作为一场记忆，散场的青春没有末路
613813537,hoterran,推荐,2012-12-09,0,怀念的是我们努力追求而付诸的青春。
31771946,高等游民阿朽,推荐,2008-02-19,0,用功读书才是把妹王道
459561772,流浪の小圆头,还行,2011-11-19,0,小清新
656334637,Emon,推荐,2013-03-19,0,"恋爱最美好的时候,就是暧昧的时候,等到真正在一起了,很多感觉都会消失不见了"
486728498,Joseph.C,还行,2012-01-25,1,电影版中柯景腾没有同沈佳宜在一起的理由有些牵强，倒是自传式的小说交代明白了。
607277371,[已注销],推荐,2012-11-24,0,很好看=3=九把刀月金牛金天秤
934191832,三四,null,2015-06-23,145,大学毕业一年后终于看完了，大部分的东西我还不能理解，有闲情的话按标题逻辑重新读一遍吧。 #字我都认识组合在一起就不明白系列#
761613521,藤堂非,推荐,2014-02-27,112,14年看的第一本书，断断续续看了很久，其实也是很适合这样随时翻开一页读的作品，有很多喜欢的意象和句子，每个人心中都有一座看不见的城市，描述得越多，你就离它越远。
620411203,风味,null,2012-12-24,18,这本书我读了三遍，事实上这书可以看三十遍，以前有人问流落荒岛只能带一本书的话带什么，我搜寻多年，终于找到了该带的书，不用再带高等数学题集了。。。。
254159195,远子,较差,2010-05-24,15,不喜欢这种纯形式的构造。
173856176,夏阳,力荐,2009-11-01,21,看不完的城市.......
74555639,苏更生,力荐,2008-11-23,11,怎么可能这么美？
779969670,阿尔弗莱格,推荐,2014-02-23,14,高三时读不下去，昨日重翻开竟一时读得入了迷。大概还是得心轻了，才能跟着这一座城市飞吧。
535533223,金满满.周,力荐,2012-05-23,10,好好好好好好书！要有多么精致的大脑才写得出这样的东西。每一篇每一段都喜欢，好美的一本书！
10287513,眠去,推荐,2008-08-02,9,我喜欢你，卡尔维诺。
589893360,小晨,null,2012-10-10,9,给高分的应该都是看懂的了吧，没有要黑的意思，只是想表达我实在是看不出门道来。。觉得很嗖桑
9689165,fwb,力荐,2008-07-06,8,严密逻辑组织下的、借助文字对城市展开的构想，不仅跟专业领域内的真实现实遥相呼应，也由于其严密的逻辑推演，具有启发专业工作者拓展专业思路的价值，换句话说，文字合乎逻辑的组织，对设计行为具有直接的启迪价值，当然，文字之所以能够产生，是有其独特的思想和价值观作为前提的。
397427161,巨米雨,null,2015-08-23,10,觉得太形而上了，马可波罗和忽必烈的对话很有意思，而城市的描写让我想起之前玩的一个游戏“walkr”，很适合太空背景的星球介绍，最喜欢的篇章是城市与死亡。【人到生命的某一时刻，认识的人当中死去的会多过活着的。遇见的每张新面孔都会印着旧模子的痕迹，是你为他们各自配戴了相应的面具】
287993729,丁丁虫・戒豆瓣,推荐,2010-08-30,8,翻译很好……但不知道作者想说什么……
1172799293,Sarcophagus,力荐,2017-04-02,8,如痴如醉，不能再置一辞。页100：“记忆既不是短暂易散的云雾，也不是干爽的透明，而是烧焦的生灵在城市表面结成的痂，是浸透了不再流动的生命液体的海绵，是过去、现在与未来混合而成的果酱，把运动中的存在给钙化封存起来：这才是你在旅行终点的发现。”这个版本有53个友邻评分，还有个版本有15个友邻评分我很遗憾……
556489864,大南瓜,推荐,2012-07-15,12,城市是看不见的，它本身就是眼睛。
32683759,shu,力荐,2008-05-29,5,你的大脑果真惊奇无比。 
505338257,英恩,力荐,2012-03-07,7,你有没有过这样的感觉：某个秋末去家对面坐公交车，经过过街天桥时，突然感觉到一种味道，你想了很长时间，终于想起这就是高一的冬天和他一起去买零食的校门口小巷子里的味道。有一种感觉跨越时间空间，以个人经历的味道感归类。我在此书中也找到了此种感觉。
549390153,Q.,null,2012-06-27,5,这个诗人，思考者，诡辩家，隐喻爱好者。阅读和倾听的意义在于共情，由此个人的世界藉他人的所行所想得以成长，但最后也逃不出人类作为一个整体的世界的边界，就像这所有看不见的城市再绮幻也不过是世间碎片的拼凑，而能够突破边界的并非文学。当然就共情的意义上我是真的很喜欢这本书
561817323,江湖骗子习新特,力荐,2012-07-29,4,数不清的美丽梦境，令人迷醉。
945718080,七月。,推荐,2015-07-30,5,“别的地方是一块反面的镜子。旅行者能够看到他自己所拥有的是何等的少，而他所未曾拥有和永远不会拥有的是何等的多。”
735668411,Bollo,力荐,2013-10-25,5,"　　""记忆中的形象一旦被词语固定住，就给抹掉了。”波罗说。“也许，我不愿意全部讲述威尼斯，就是怕一下子失去她。或者，在我讲述其它城市的时候，我已经在一点点失去她。” "
39127601,喜北肉豆蔻,推荐,2013-06-18,3,读到中间有点厌，过了70%以后又开始好看起来。
306311013,K小北,推荐,2010-10-21,3,精巧的Y。
87969369,Yanisk,推荐,2013-06-01,2,免遭痛苦的办法有两种，对于许多人，第一种很容易：接受地域，成为它的一部分，直至感觉不到它的存在；第二种有风险，要求持久的警惕和学习：在地狱里寻找非地狱的人和物，学会辨别他们，使他们存在下去，赋予他们空间。
320004532,魏小河,推荐,2012-02-20,2,。
148852507,韧勉,力荐,2009-08-19,2,绝美~
10807680,傅踢踢,力荐,2007-02-20,3,这是什么样的想象力啊
190445234,野次R,力荐,2009-12-15,2,最后 都是虚无罢了。剩下的 不过是黑白格子。我在叙述时 你已经从掌心淌走了。
97232889,皇后大道西,还行,2009-02-18,2,坑爹的翻译啊！
713978658,夏一慕,推荐,2013-08-11,1,这城市的记忆，过期不候。
194816596,蜜三刀,还行,2009-12-26,1,"卡尔维诺总是无法让我喜欢。
比本雅明的《驼背小人》差远了。"
202462345,叶酱,力荐,2012-08-16,1,关于城市的记忆，欲望，符号，名字，死者，还有无限的可能性。
398204707,方枪枪,推荐,2012-06-01,2,文字读起来有酣畅的轻快感
29357077,ztlpoppy,推荐,2008-01-21,1,卡尔维诺笔下的虚构城市，不得不佩服他超人的想象力，我在惊艳他文笔的同时，也深为这点所折服。他独具匠心的为每个城市取女人的名字，安排繁复、不可思议的剧情和场景，觉得像雕琢一件艺术品，用锉刀几乎没有表面积的尖去磨干净所有的粗糙。最喜欢的城市中的人们住在一个被分为两半的城市，当他们厌倦了一半城市的生活及搬到另一座，改变角色，职业和伴侣。我们生活是如此单调和划一，也只能用这种卡尔维诺的构思去暂时减缓压力
6170907,离净语,力荐,2006-10-10,1,库哈斯的“普通城市”将是这本书的终章：第五十六个城市
579926371,小心和小欣,推荐,2012-09-13,2,城市是一种生活方式，它并不会让生活更美好，它只是适应于人类大规模消费、大规模浪费、大规模行动的本能，它只是将人类的欲望无限放大的场所。
658461576,技术原因Herta,力荐,2013-03-24,1,我将启程去探访一座远方的城。
245343633,狮子人,力荐,2010-06-18,2,你曾想过的 就让它流走了 卡尔维诺只是抓住了它们
104690095,短章,力荐,2010-12-01,1,这本书所唤起的不仅仅是一个与时间无关的城市概念，而是在书中展开了一种时而含蓄时而清晰的关于现代城市的讨论。对一个古老城市的回忆的东西，只是因为被与眼前的今天的城市一同去想和写，才有了意义。
325492394,小易甫,推荐,2010-12-11,1,越到后面就越发浪漫主义得让人把握不了。
776806861,大灰狼,null,2014-02-13,3,毫无疑问卡尔维诺是一个结构主义者
80714694,希夷子,力荐,2008-12-18,1,水晶魔方
598130303,[已注销],力荐,2012-11-11,2,太美了
217468031,米粒,力荐,2010-02-15,2,想象力绝顶
657988105,反山,推荐,2013-03-23,2,一本神奇的书，卡尔维诺的大脑构造甚是奇怪。
