929649483,ztlpoppy,推荐,2015-06-08,0,记得看的时候心里莫名的伤感。想去一次箱根
23005171,Ghost,力荐,2007-11-01,0,村上所有作品中最喜爱的一部
234603395,[已注销],还行,2010-03-29,0,图书馆走马观花的看了一边
927359913,莫江南,null,2015-05-31,0,生命中多的是无可奈何
299406255,子岳,还行,2010-10-01,0,很久没看过小说了
976337881,北纬,null,2015-11-11,0,沙漠也不会活着的 不是被不确切的东西追赶 是被他人或者说是假象 没有存在 只有虚无
288042469,cheri,推荐,2010-08-30,0,细腻
741802489,蝉,null,2013-11-04,0,:I313.45/4925-12
29725695,霏昀,力荐,2008-07-11,0,写完消失不见，就看到消失不见。读得很应时的一部，于是感觉也非常好。
1807190843,Vani,推荐,2019-06-01,2,用了三个小时一口气读完。 书里幼年岛本相关的情节让我想到了秒速五厘米，岛本和明里一样，在幼年时期就与主角被广袤无垠的时间和茫然巨大的人生分隔开来，只剩魂牵梦绕的回忆。无论是梦里一起看樱花亦或是在箱根别墅里听唱片，都不过是主角潜意识里对那段美好回忆的追忆。不知为什么，我仿佛特别容易被类似的情节所触动，明明没有类似的经历，却每次读到时都有一种强烈的共鸣感。
41078618,w小O,推荐,2008-05-18,0,@很尤耍真的尤恕…
1816819121,Ontario,还行,2019-06-09,1,17/30  3.5星吧 不管是什么时期的哪本书里什么故事里的男主都给我一种相通性：就像我现在在读初君和岛本的时候 我不自觉想起来燃烧里独自躺在海美床上哭着自慰的李钟秀   而岛本和海美最后都彻底消失（死）了  书里中年男主的脆弱大概都源自女性  也都被女性治愈？ 这也是我越来越不想看村上的书的原因。 关于西伯利亚癔症 不知为何让我想起满洲里席地而坐的大象 
501199464,Olivia,力荐,2012-02-27,2,一个人的人生归根究底只能是那个人的人生，你不可能代替谁负起责任。
74627076,Mu,推荐,2008-11-23,0,恩恩 写到很深的地方去了
487511043,林,推荐,2012-01-27,0,莫名其妙，还不错
562982921,当里个当,力荐,2012-08-01,0,村上写国境，写到了自己的高度、个人意义上的集大成。用独生子这个题材写出了一代人的孤独星球，从而引起强烈的共鸣。村上是对的，也是绝望的：“我无论如何只能是我，仍将重复同样的错误，同样伤害别人，同时损毁自己。”
333263330,阿翮,推荐,2011-09-17,0,看你，有时觉得就像看遥远的星星。看起来非常明亮，但那种光是几万年前传送过来的。或许发光的天体如今已不存在了，可有时看上去却比任何东西都有现实感。
8534186,U 兔,推荐,2006-12-28,0,061228标记读过。前些天重看，151023凌晨看完。相隔近9年，看书时的心境和状况也完全不同。觉得这书没有那么无聊了（虽然相比其他还是略寡淡）依然喜欢对青年时独生子的描写，残疾的女孩更像是独生子那从别人的妈妈肚子里钻出来的姐妹，所以最后的场面多少有了点伦理的刺激。三个女人完全三种面貌，在我的生活中有不同的地位，就好像是我经历过的截然不同的时期。借用感情清晰地勾勒出一些对生活的看法，使原本模糊的东西有了一定的形状。生活的样子到底是白兔还是怪兽呢，自己去看好了。
562508794,开膛手贝塔,推荐,2012-07-30,1637,"我喜欢刘震云这样说话，喜欢这样的话，不是因为他说的多么高深，而是觉得这话虽然绕，但所有的落脚点都站到了理上；喜欢这样的话也不是因为句句在理，而是因为这句句在理的话如果不用这样的话来说，就失了些乡土气的风致；其实也不是因为接地气，而是人世间的很多事情本来就是如此，绕来绕去，本来是这样的事，后来也便成了那样的事了，本来是一件事，后面也变成千万件事情了。
"
189695039,按时,推荐,2010-01-31,1029,又名《关于“不是……是……”的一万种造句法》。
502625535,周不r,推荐,2014-07-09,798,人活一辈子，不图啥，就为个说得着的人。有的人从前说不着，过些年却说得着了；有的人从前说得着，说着说着却忽然说不着了。什么爱啊，亲情友情啊，也就是看说不说得着，真难过。
452430625,思萌,力荐,2011-11-23,706,不要说精神的痛苦只有知识分子才有
779543812,熊阿姨,力荐,2014-02-22,214,书里的人物都亲切，好像小时候听妈妈讲姥姥的故事。回到循环的人情世故，村庄和田野都装着小人物们类似的命运。北京的凌晨相比之下寡然无味，书里最辽远的一桩孤独，就是巧玲“一梦醒来，窗外的月牙，映在枣树的树杈间。”
584753799,[已注销],力荐,2012-09-27,171,中国人没有信仰，西方人信神，我们信人。只要活着，就无法摆脱人际关系对我们的影响。神有定性，可人没有。可能因为一句话，朋友变成仇人；或时过境迁突然遇到，仇人又变成朋友。在中国人这里，朋友不一定说得上话，说得上不一定是朋友。就这么乱七八糟，都在壳的外边。壳的里边，永远是一颗孤独的心。
736060810,ANGEL DUST,推荐,2013-10-22,128,1、和平年代的战乱感；2、说不出来的苦才是真正的苦；3、我从未见过比刘震云更嗦的人。
953520192,死神的挽歌,力荐,2015-08-26,138,刘震云最常用的句式：“（某件事）不是因为...，也不是因为...，而是因为...”，这一下就扯出了好多事，带出了好多理。这些理看着挺绕，挺扯，但细想起来，还真是这么回事。这也正是本书的主题：一个理看起来一句话就能说清，但放到真实生活中，可能一万句话也说不清。所以，要找个能说上话的人（无论是朋友还是亲人），真是太难了。吴摩西半生坎坷，看着处处占理，却处处说不上话，一直在人生路上奔波，只知自己叫什么，从哪儿来，却不知要到哪儿去。牛爱国是吴摩西的翻版，表面上看一个出延津，一个回延津，但实际上都走不出心灵的困顿。
982383472,琼斯黄,还行,2015-12-03,127,世上的事情，件件藏着委屈。永不来往，就是永远和好。
499745199,卡列宁の微笑,力荐,2012-02-23,75,这是一部讨论【交流】的小说，书里的人物们用千差万别的方式在各种排列组合中鸡同鸭讲，书中讨论了中国人传统的交流模式，涵盖你所能想到的交流障碍，很像是《巴别塔》的中国版。
322846947,阿思琅,力荐,2010-12-05,90,少有的两天内一气读完的当代中文小说。人寻人，话赶话。我们的孤独，全在不确定的追寻之中。
625049592,苏筱兀,力荐,2013-01-03,70,老爸说《一句顶一万句》整本书都是车轱辘话，翻来覆去地说，看不出来什么。但他还看得津津有味。书中讲得都是身边人身边事儿，将每一个人每一段人生每一个细节都放大，每往前走一步都能捏出苦水来。别说永世知心人，有时候找个说句话的人都难。出延津，回延津，哪里出于自愿，都是被逼出来的。
934624880,鲁闽,推荐,2015-06-26,57,虽然才看，但知道这本书很久了。当年此书上市，我和朋友在大学书店看到大约写着『中国人为什么活得这么累』的腰封，觉得出版商用力过猛，笑得不行，也就算了。如今读了，有几点感受：第一，内容的确有意思。第二，枝叶繁茂得有些分散，可能剪一剪更好，特别是前面讲过的故事重复讲一遍，我不知道是几个意思。第三，如果回到『中国人为什么活得这么累』这个话题上，我认为找到一个说得上话的人恐怕还不是关键所在，甚至可能是完全搞错了方向，关键还是不懂得自处，总想着把人生寄托在人与人的关系上，变量一多，能不累么？
824521582,Estelle. Q,力荐,2014-07-11,51,写了我们每个人的别扭，每个人的孤独。
110548346,红尘白昼,推荐,2009-04-06,50,绕来绕去，一件事后面往往藏着八件事；一件事中间，又得拐好几道弯，找个说得上话的人，那是真难，怪不得叫一句顶一万句。
1106872965,另一种王绥,力荐,2016-11-08,50,我就服老刘絮絮叨叨的能絮叨出这么大的格局，看哭了。
487598387,cub18,还行,2012-01-27,41,和其他当代作家一样，时代的焦距一旦推近，厚重感即削弱，所以小说下半部比上半部弱许多。小说的视角独特、平实：和身边的人说不说得着话。喜欢书中由此对《论语》和《圣经》的解读。“有朋自远方来”是孔子感慨身边没有人说得上话，《圣经》是要人在心里忧愁没处说话的时候知道去找神~前半段那些小故事很有爱。
956110430,Shann_Z,力荐,2016-03-09,50,我曾以为生命中最糟糕的事是孤独终老，其实不是，最糟糕的是与那些让你感到孤独的人一起终老。
561005128,Alkis_Tangelis,力荐,2012-08-02,34,各自都成家带孩子以后，曾经掏心掏肺的哥们们都说的少了，就算说，也多是闲聊一下八卦，愤青一下物价。你说把这书推荐下说还不错，没回音，说油价高，过路费免了才终于有个回音，这跟老刘想说的那种感觉一样不？
471341501,春暖花开王大拿,推荐,2011-12-19,74,看着看着怎么就突然没了
441283676,桃桃淘电影,null,2011-09-30,38,看前面就像几个农村老汉喝多了在炕头说的酒话，张家李家说没够。看着看着就变得苦了，翻来覆去都是为了个能说得上话的人。能把一件事说能N件事的这不就是我么，到头来把最初想说的都忘了。汗
181560394,杜边生,力荐,2009-11-23,39,害老子一夜没睡。看完又想再看遍余华。
447126204,张叵测,力荐,2011-11-01,42,"不是喷空，而是走戏；
不是喊丧，而是大教堂。
不是说得着话，而是一句顶一万句，也不是一句顶一万句，而是“不，得找”。"
843109494,Cold Black,推荐,2014-09-09,33,后四分之一有点弱，其它很牛。。。
1095402662,王大根,力荐,2016-10-09,30,早知道该学门手艺
579289112,southstarj,力荐,2012-09-14,32,读着读着，心里一阵苦涩。本以为我们的苦只和我们这一代有关，原来从古至今的中国人，时代虽然变了，但是从根儿上苦的都是一个东西。中国人一辈子活着老是这么苦，图什么呢
534095784,飞行官,力荐,2012-05-20,36,”……徒儿们以为远道来了朋友，孔子高兴，但老汪说高兴个啥呀，恰恰是圣人伤了心，如果身边有朋友，心里的话都说完了，远道来个人，不是添堵吗？”
300329637,任晓雯,null,2012-09-06,27,读《一句顶一万句》。刘震云借着书中人说：啥事都是个绕。这个“绕”字也是整部小说的风格。绕得有滋有味，有声有色，一圈兜下来，就把生活说圆了。长篇小说是个空间相对疏落的体裁，不必每个细节都紧附着主杆。有时候，长篇小说的趣味正是在于枝枝蔓蔓，旁逸斜出。
579760144,小星星,还行,2013-10-18,32,读不下去，读不下去不是因为这不是一本好书，而是因为大爷太嗦了，人物也不是特别有故事性，都是家长里短；也不是说家长里短不好，而是我本身对别人特平淡的事儿没多大兴趣；也不是说我对所有人家长里短都不感兴趣，关键它不能引起我的共鸣和反思；不能引起共鸣反思也不是说这书不好，说不定是我岁数不到，感悟不了那么多呢。
386062783,junepig,推荐,2011-05-13,25,把烦闷的、琐碎的、漫长的人生掰开了揉碎了，以为能找到什么生存的真谛，人生的哲理，却发现里头裹藏的不过是宿命两个字，所以最要紧的就是在这宿命当中，找个最要紧的人，把那句最要紧的话说出来，一句顶一万句。
554381334,得・半生君,推荐,2012-07-13,28,真的是百年孤独，真的是百年孤独
437216512,[已注销],力荐,2011-09-17,18,“你心里总有忧愁。”
1011786838,林怪兽,力荐,2016-02-16,16,这本书无论随便翻到哪一页都可以毫无阻碍地一直看下去，每个字都是戏。没有描写，全是叙述，上百个人物一一登场，几乎全是酱油党。好到不知该怎么夸。
958691644,破罐心碎了,力荐,2015-09-27,11,看完下半部觉得上半部无比好，觉得还可以有续集。那种无人说话的忧愁真是像波纹一样在水面层层推进，一环套一环，人物繁多不乱，场面和情景让人如临其境又恍若浮世。
641815457,辄馨,力荐,2013-02-11,7,不悲天不悯人，平实乐观，不失人性。我觉得，乐观和人性这两点，是我从早到下午不写书评也要把这本书看完的原因。多亏了我去年一直在晋冀豫交界的地方坐田野，延津周围这些地名倒是倍儿熟悉。
906825029,兔纸不会飞,还行,2015-03-27,11,看了三分之一我决定不浪费时间在这家长里短了……
954771302,Leo____L,力荐,2015-09-05,9,非常亲民精彩，对中国老百姓的小九九和绕弯有着极其深刻的洞察力，读来轻快幽默，非常喜欢，前半段像在看一部精彩的喜剧。后半段的寻亲路也很不错，似乎有很多历史，但人终究是活在当下和未来的，往前走吧，青年！
195843600,StarKnight,推荐,2009-12-29,10,读毕，挺喜欢。叙事细碎不拖沓，一件件一句句掰得干干净净。前半部比后半部好看。
1269718122,大u,推荐,2017-11-11,7,不是每件事都会有一个结果
1317027643,沈十六,力荐,2018-02-02,5,故事真苦。文字没有赘笔。普通人的生活里也有大哲学。人生在世，就求一个说得着。
1158229779,加,力荐,2017-06-07,9,刚开始玩QQ的时候和所有陌生人都能说得上话。
1047824262,[已注销],力荐,2016-06-08,8,茅盾文学奖作品，横跨七八十年的几辈人的故事，有关家庭亲子、爱情婚姻、朋友等等，都是在找一个能说得上话、聊得来、能交心、能建立亲密关系的人。文笔很乡土气息，跟《白鹿原》类似。故事很棒，体系庞大，人物众多，关系错综复杂。支线故事很多，没有最直接有效的主线，有点像《百年孤独》，也是讲孤独感的。部分叙事略嗦，一个事情会翻来覆去在不同场合讲好几遍，绕来绕去，但也恰好说明了能找到一个说得上话的人不容易。整体很推荐，很精彩的小说。
691117712,袁牧,还行,2013-06-10,8,作为老刘的真粉很失望，居然是这得了茅盾人情奖，没故乡系列辽阔，没单位系列阴险，没官人系列犀利，没一腔废话癫狂，没特色，没新意，婆婆拉呱，说来说去还不是你前几年村里那点事儿。看来看去还不是几年前的老杨小韩老张，打分不拿人话拿人，就这句拿你，老刘，你又走绕回来了。PS:不过我没看完。
605642045,玛嘉烈玛嘉烈,力荐,2012-11-20,7,人生在世，草木一秋，为的就是能够找到一个可以说的上话的人。可是有多少人就算顷尽了这一生还是找不到这样一个人，这才是最孤独的事情。刘震云把这种孤独写的真好。
519469864,小二,力荐,2012-04-12,7,刘震云来至在延津口，一句话，把千年的事情说个从头。
755521579,炸啦,推荐,2015-02-22,9,上帝视角，刘震云知道说话双方的心理，可这两个人不知道，说不着说得着真是要命。一句话能杀人，一句话也能救人。延津女文青曹青娥
741885688,黄耀明,推荐,2013-11-04,6,一口气读完
815280944,弦月,力荐,2014-08-10,4,陪伴我整个旅途的一本书，轻松接地气又搞笑。记得在五渔村，坐在长椅上看日落，眉飞色舞的给先生讲老詹给延津人民传教的故事。
607495731,阿瓦尔古丽,推荐,2012-11-25,4,有说话的人。
1048152690,荒 原 良 生,推荐,2016-06-03,5,车轱辘话来回绕绕的都是家长里短，说的上的那句话却是人间沧桑。
1109840344,从 军 行,推荐,2016-11-16,4,有一种比较深沉的内在。
439215219,Jack,null,2011-09-24,4,这本书很好看
484126217,索芭蕉,力荐,2017-07-12,4,有人喷空真好啊
1115598576,神威,推荐,2016-12-01,4,休憩191st，复杂的简单，两个主角杨百顺，牛爱国，到一重配角杨百利牛青娥还有名字都没有的老马老杨老XXXXXXXXX，说出了很多人生道理，经过了很多人生故事，最后求的也只是一个聊得来，说得上话，老杨三句话说对就把秦曼卿变成自己儿媳，也因为说得上话而忍受了老马四五十年的鄙视和不过心，在他人眼中变成了个上赶着的傻鸟，刘震云，你到底多孤独，内心到底多曲高和寡，凑巧昨夜下飞机后彻夜重温了三体II，就补你一句吧，如果心里真这么苦，那就“做自己的破壁人”好了，心灵困顿无计可施的状态无法描摹的更佳，可惜杰出不代表不必烦恼，sigh
1085085876,晴阳阳,推荐,2016-09-15,4,我看这本小说，不是因为她女儿拍了电影，主要是因为看到电影出来想起这本得享大名我还没读过；我觉得这本小说好，不是因为故事说得多新鲜，主要还是因为语言风格非常动人；我不太看好电影，不是因为对他女儿有偏见，主要还是觉得文字水平越高的小说越难改编，女儿来拍又不敢大动刀，当然就难出佳作了。哈哈哈！
997787533,sisyphean,推荐,2016-01-09,4,觉得好笑，想想却是真的，不然包邮群也不会天天觉得周围都是傻逼没法交流千里迢迢见面就为说个话，和书里一模一样啊！
967975074,水岸L堤,推荐,2015-10-15,5,上部很好看。下部好看。
1273993819,丁一,null,2017-11-20,3,"中国平凡家族史，
翻开家谱抖尘埃，
尘埃落定一百年，
浩浩荡荡白茫茫，
一地鸡毛与皮屑，
爬满蚂蚁与虱子，
吃喝拉撒嚼舌根，
生死疲劳又百年
"
127319864,傅踢踢,推荐,2009-06-04,2,刘老师这次不像前几本单纯为了说点事儿，连篇累牍的“不是……而是……”句式就是为了告诉你中国人说句话能转多少个弯，本来一件事能怎么给说成另一件事儿。另外，“说得上话”和“说不上话”能给人带来多大改变。这个话题还挺有意思的。小说本身有点绕，前后半部线索接在一起之后挺好的。
828272506,远风,推荐,2014-07-22,5,这是一部纯之又纯的中国式白话小说，很明显有别于外国小说那种电影化叙事，延续了明清小说、沈从文汪曾祺一脉传统，讲述中国人的人情世故、悲欢离合。刘震云以他独特的京贫风格――也带那么点河南味，密密匝匝絮絮叨叨绕来绕去讲述了一长串小故事，汇集成一个精神寓言，一部孤独史，一幅人性图景。
1330107935,瓜。相信这个世界很变态。,推荐,2018-02-23,2,上部是说出走，下部是讲回去，核心都在于找说得着话的人，这也是我们穷一生所要做的事。故事会让人丢失时代感，缺乏代入的想象空间，人事形形色色如走马灯，但孤独感一直在。
1208302283,水仙操,推荐,2017-06-28,2,轴。车轱辘话理不尽。老汪他爹处事与人不同，同样一件事情，对自己有利没利他不管，看到对别人有利，他就觉得吃了亏。“主他爹也是个手艺人，是个木匠。”“隔行如隔山，我不信木匠他儿。”“孩子，头一回我不以主的名义，以你大爷的名义给你说。” 但一个人自己别扭，也比再让别人别扭自己强。
573388880,左胸上的吸盘,null,2012-08-27,2,已毁于萌萌。
561077727,不舍昼夜,力荐,2012-07-28,2,写得好，开眼界，原以为国人都不会写小说了。没有一个文艺词儿，重结构，还沾点儿圣经。很多人说后半部弱，没觉着。
444832258,云中,力荐,2011-10-10,1,出乎意料，写得真好
1014456054,尼云格勒・大玛,力荐,2016-02-23,3,人情世故句句在理，绕不开的孤独，我苦难又深沉的民族
557507166,蟹香,力荐,2012-07-18,2,看到最后，百感交集，眼泪划过。近年来看过的最好的中国小说。
586525579,奇诺,推荐,2016-04-20,3,一个人的孤独不是孤独，一个人想找另一个人，一句话想找另一句话，才孤独。
289902477,尚友古人,null,2010-09-14,2,人心，人心。汉子不是汉子，婆娘不是偷人，就是河东狮吼。
1004970835,原来是小浪呢,力荐,2016-01-28,2,世上的事情，原来件件都藏着委屈。永不来往就是永远和好。
113206763,一个小标点,推荐,2010-11-13,1,非常好。
1178296729,徐内向,还行,2017-04-15,1,一群农妇唠家常
691705914,静岳,力荐,2013-07-21,3,今年读过的小说类里，这本最好。好到不太敢去细想中间的关节。
960284389,dellizheng,null,2015-09-19,6,在飞机上读着读着，竟两度落泪。打开身旁的遮光板，俯瞰苍茫大地，突然觉得自己很远，离什么都好远。有些话，当时没说，窝在心里就是一辈子。又想起小时候，与天地作伴的日子，不知道当年给我快乐的蛐蛐蚂蚱蜻蜓们，它们的后辈可还安好？多久没无忧无虑过了？
1096959016,善良的蝮蛇,推荐,2016-10-16,4,以轻写重，不然世事太重，根本写不得。有些地方语言有点油腻。人都是孤独的。感谢豆瓣。浪迹天涯的时候要用童年偶像的名字。
571037034,荒人,力荐,2012-08-21,3,"一个人的人生，最大的幸事就是能遇见说的着的人。最大的不幸就是遇见了说不着的人还阴错阳差傍在了一起。但是即便遇见了说的着的人，也不会一直说的着，人是会变的。
　"
433976863,解惑蠹虫,力荐,2011-09-07,3,"出走并不是因为孤独,而是为了寻找"
1315462627,1.,力荐,2018-01-30,2,世上人与人的关系就是说得着与说不着的关系，说得着围炉夜话，说不着分道扬镳。但是说得着说不着也只能成为朋友以后才能知道。一句顶一万句，与说得来的人一个眼神都胜过千言万语。
1276026921,栖栖子,推荐,2017-11-24,2,刘震云的写法，是一句话逗一句话，一个事引一个事，好比坂坡走丸，银盘落珠，看着像是一点不费劲儿似的，就把这世上隔着十万八千里的两个东西就嘟噜到一起了，也不是凑到一起了，是事理正应到此；也不是事理正应到此，是人情非要推究到这地步；也不是人情非要推究到这地步，是心肠里空荡荡的总要有个挨处；也不是心肠里空荡荡的总要有个挨处，是兜兜转转啊发现自己最终还是原来的地方收住。（曹青娥梦吴摩西、梦老曹两段，尤见笔力）
1112068748,Liane,较差,2017-02-09,2,清空kindle：着实一种进屋上炕 家长里短的感觉
878868931,大士かっこいい,力荐,2015-01-03,4,生活不是啥大学问，看人也就是看个说话”。能说的，会说的，爱说的，不爱说的，喷空的，吹牛的，骗人的，造谣的，喊丧的，说媒的，唱戏的，传教的。都说人活一张脸，莫不如是人活一张嘴罢。过日子，可不就是为了找个说得着话的么。
599127110,龙三,力荐,2012-11-04,1,"过日子讲究一个说得着说不着。说得着了万事顺遂，说不着了一拍两散。为寻这说得着，杨百顺离乡背景成了吴摩西，失了这个说得着，吴摩西亡命天涯成了罗长礼。还为这说得着，七十年后的牛爱国四处奔走，轴在了路上。七十年，风风火火出入延津，表面热闹，却是小一百年的孤独。
"
1796146270,阿梦,推荐,2019-05-23,0,之前看话剧版《出延津记》觉得时间线有点儿乱，这一是因为故事背景交代不足；二是因为剧情侧重描写群像，一人一笔便打散了重点。看过原著才知，话剧剧情的问题出于原著自身的结构问题。刘震云行文流畅，书写近乎口语。他通过笔下不同姓名/经历的人物，在述说人们在生活中遇到的同一个困境，即人微言轻。大家心里有话想说，但找不到可以述说的对象，憋着憋着生出许许多多曲折。人们都是孤独的，知道自己是谁，从哪儿来，却不知道可以到哪儿去。
122580152,Nosferatu,力荐,2009-05-19,1,看完了，不错的一本小说
1323971537,张躲躲,推荐,2018-02-14,0,看过电影再补小说，发现电影只能拍出冰山一角。小说文字里那种孤独很难影像化。
595896847,攸宁陶陶,力荐,2012-10-26,1,生活就像一出裹着乱麻的戏
1139101127,江凌,推荐,2017-01-19,2,中国农民几千年来过日子的人生哲学，被刘震云绕来绕去，讲得倒是通透无比。
209664793,舍得,力荐,2010-08-10,1,我们都需要朋友，我们都需要友谊！
724114451,阿舒,推荐,2013-09-07,3,很有味道，抓不住的东西，实实在在的放在眼前，你加把劲儿，才能把它看通透
1704609798,马曳,推荐,2019-03-05,1,可把⒄痣近作都看完了。@些年的L篇一篇比一篇熟，男≌hx的角度碚h，一句一f句比④SM或是吃瓜r代的号要好，後面太像是殡影而作的小h，Y工整，「泻凸奏感恰到好，但就反而有c失了好小h那N山F罩琵琶遮面的意思。
781336139,彼得潘耶夫斯基,力荐,2016-02-13,2,深得明间说书艺术之精髓，一个字:绕。
