583420717,机-丹尼尔-玛格,推荐,2012-09-24,1,"不知为什么前面看引言的时候很想撕书,因为受不了形容形容形容形容,绕着弯的着字, 幸好正文越来越流畅,老几终于被释放,婉喻却好久都不回信,我以为老几带着一肚子的忏悔等了那么多年,婉喻是不是死了.结果不是,最悲哀的是她得了老年痴呆,永远记得自己在一辈子等焉识,却不认得他,直到死."
1043627163,但fL月,力荐,2016-05-21,2,最近几年读到的唯一一本让我泪流满面的小说。。。电影改编的太弱太肤浅了。。。
803152106,哈哈,力荐,2014-05-05,2,都是好句！
471353872,"Orange,",力荐,2012-05-07,1,第一次读严歌苓的书是因为看了赵薇演的电视剧，后来闲着无聊就上网搜跟她有关的消息，冲着“好莱坞编剧”几个字，在卓越上买了她的一本短篇集，读了《少女小渔》，再接着就几乎把她绝大部分的书都看过了一遍。长篇还好，很多短篇到现在讲了什么已经记不清了。唯一记忆犹新的是她每本书里所写的那些女人，她们大多都不是为了自己活着，而是为了她们爱的男人，或是为了守护自己需要用一辈子去守护的，被她们看得比自己生命还要重要的东西。这本书里的婉瑜也一样，她爱的男人在最开始并不爱她，或许说是并没发现自己爱她。一生里先是因为恩娘，后来是因为政治，到老因为记忆丢失，她和陆焉识始终被这些东西隔开，她临终的时候说，路很远的，也是为了袒护自己在生命最后阶段所等的人，即使她无法理解最后几年，她想要的已经得到了，她等的人也已经回来了。
1612053447,圣无常,力荐,2019-01-05,1,在这个国度，不管什么时代，要当个清高的自由的文化人，太难太难了，还不如装个结巴。
838095905,SY,力荐,2014-08-20,1,严歌苓真的是太会写“戏”，太会讲故事。鉴定完毕。
706023773,夏雨路,推荐,2013-07-19,0,依然是强悍的女人与强悍的爱情。看了一上午……
1803154495,Harvey,力荐,2019-05-29,1,这书绝对严歌苓的巅峰，无法超越的巅峰。
968673890,MetalDudu,推荐,2015-10-17,0,错过媒体炒作的时期，读这本书可能更适合，读完也不打算看电影了。小说以“我”的视角推进，时间切换都是技巧，我以为并不必要但挺有心。两个深刻的方面：第一是大历史背景下的人物命运，虽然是小处着眼；第二是无法相见的爱，深沉并且毫无道理，每个人背负的命运之恶。结尾一部分岔开写子女争抢房产，似无必要，结局甚佳。20151014
786932336,Ex,推荐,2014-03-21,0,读的第一本严歌苓，很震撼！许多种爱情，许多种死亡，许多种隐忍，许多种爆发，许多种惊喜，许多种绝望，许多种理解，许多种困惑，这些需要岁月的历练才能读懂，需要充满温情与敬意的才情去书方能触动人心。20140321，01：13读毕。
816519016,玛玛玛法达,还行,2014-06-15,0,通俗小说里有手笔和有野心的作品，但是全知全能得不到位，对于主角缺乏一贯且流畅的叙述，人物欠活气，对角色有任何看法或者无看法都好，但总是提线木偶一样欠笔力
211638206,8mile,力荐,2010-02-25,601,其实我不了解的是中国
413849266,伊卡洛斯,力荐,2011-07-14,230,如果你追求阳光，你就躲不开身后的阴影
636292434,无声时代・歌姬,力荐,2013-01-29,116,了解美国，建议从林达入门，但要超越林达。PS：竟然是十五年前的书了，里面的观察很多都还鲜活地存在着。PPS：这就是所谓的“长销书”吧
420839883,一凹,力荐,2011-08-24,79,作为看美国的第一本，林达向我们介绍了美国的宪法和世纪大案――辛普森案，二十世纪的美国在民主、自由、平等、人权方面的先进保障，我们今天看来都是望尘莫及的。可悲的是，中国政党并没有意识到在人权的根本上改进，而是一味维持社会和谐、人民安居乐业的假象。文中的每一个字都是一剂阿非他命，打进我们的血管之中，振奋了久久萎靡在黑暗和阴霾中的每一个热爱自由的中国人。
629889166,Adiósardour,力荐,2013-01-15,27,国内大众对美国民主的认识可能仅停留在骂总统，枪支泛滥的误解上，林达在枪在谁手里中讲述了日本留美学生被开枪打死的案例，非常令人触目，在美国你有可能因为掉以轻心和语言不通，而在误会下被合法的枪杀，更可能发生在别人家门口多转了几圈就被警察逮捕的情况。这就是美国权利法案里表明的，对私人财产的绝对保护，对于这样一个强调保护个人隐私，私人财产和私人领地的国家，发生在中国的强拆强占，文革的抄家都是难以想象的。枪杀案件善后中克林顿面对该留学生的父母时，只能一再强调表示遗憾，而处于外交上的考虑而干预司法，几乎不可能的，对于美国总统而言最顾及的是国内的原则和逻辑，国际影响相对的是次一步的了。当我们试图了解美国民主时，应该了解到自由不是美国民主的重点，重点是自由背后的代价，要知道投出一片阳光，就必然落下一片阴影。
360509837,彭萦,力荐,2011-03-15,18,看了这本书怎么能不为美国的制度和文化而动容啊.....
923513661,逍遥未遂,还行,2015-05-19,19,言论自由的关键是什么呢？我想，关键就在于它的“内容中性”原则，就是要把“真理”二字坚决地摈弃在言论自由的大门之外。只要让“真理”二字一不小心从门缝里溜进来，言论自由就完了。
578612972,fwb,推荐,2012-09-10,11,关于辛普森案件的描述（为了“公正审判”，只能损伤“实现正义”），最能表达本书的基本态度――没有十全十美的社会！为实现一个目标，必然要付出相应代价，而这些代价，往往是由于一系列清晰的、被宪法确定下来的、要严密保护“个人”的价值观导致。美国从上到下，都普遍接受这样一个现实理性常识。
371574031,小晨,力荐,2011-03-29,17,虽然这本书未必百分百客观，但是还是填补了我许多美国历史知识的空白。不得不说两年的美国生活我仍然只对美国一知半解，读了这本书会让我对在美国的体验有了更深刻的体会。连读wiki都没搞明白的O J Simpson案，这次也终于搞明白了。这书不完美，但是读读有好处。
532959043,别歌,力荐,2012-05-17,17,类别：社会制度。通过信件方式全面介绍美国的司法制度。核心：自由的代价是什么？林达的美国系列，作为对美国社会了解的小窗口还是不错的，也是学习法律专业的兴趣读本。
423322691,雷 托,推荐,2011-08-08,11,梳理了逻辑 平衡了理性 跳出了狭隘
382875818,考拉小巫,力荐,2011-05-12,10,写得特别严肃，但很真实，信息量非常大。跟刘瑜完全不一个风格。
510362666,猫糊糊,还行,2012-03-20,5,读这么嗦的书的我才忧虑呢 
522793506,柴斯卡,推荐,2012-04-21,6,我本来还觉得这书有种微妙的甯泻拖哺心兀谢谢豆娘又禁了我的日志，气得我瞬时对林达都充满了好感。。。！！！（中二病复发）
708329137,筱堂,力荐,2013-10-27,7,关于民主政治的一本启蒙读物，通过历史故事和案例，深入浅出地解读美国式民主，其中所谈到的言论自由、新闻自由、集会自由、三权分立等，真是令人神往。联系到国朝卫巫弭谤、道路以目的现实，不胜其感慨。我总好奇法学专业的老师是怎么授课的？是不是每次讲课之前，都要声明一句：“我们所学的是各种普适的原理，但并不适用于神奇的国度。如有雷同，纯属巧合！”专制集权是产生各种伪的总根源。好在飘风不终朝，暴雨不终日。世纪伟人曾说过：“世界潮流，浩浩荡荡。顺之者昌，逆之者亡。”真可谓善颂善祷矣。十三年十月廿七日筱堂记于长沙望岳楼，是日天朗气不清也。
1086787714,NADPH,力荐,2016-10-13,7,美国是这个样子哒，有没有人来说说中国是什么样的，虽然在中国住了二十年了，可是我还是看不透这个国家。
605408305,田野,力荐,2012-12-05,6,“言论自由与言论内容无关，与言论的正确与否无关，与真理还是谬误无关。”
125271089,蓝调共和,推荐,2009-05-30,3,浅显易懂，感性丰富
16560,蓬蓬,力荐,2005-06-15,5,唯一一本买过三次的书：第一本被老爸抢去自己看；第二本被老爸抢去送了人；第三本，总算保住了。
932539703,维城乱马,推荐,2015-06-29,4,辛普森案写得引人入胜身临其境
102700398,Ejing,推荐,2010-05-18,2,三权分立在详细案例中跃然纸上
799606091,菱夏,推荐,2014-04-23,4,世界和人性皆复杂，没有一种制度可被奉为圭臬放之四海皆准，或许我们不该对自由、正义、道德正确过多的固执己见，应克制情绪尽量保持中性，97年的书固然有局限但还是提供了一些深思的角度。我想一本书带能给你的，最好不是是幡然醒悟，而是更广阔的视野和继续探寻的好奇
785765720,骨小头,还行,2014-03-13,2,哪有什么高下？我倒向往个体感几乎不存在的“夜不闭户”村寨时期。
549570321,xiaohanyu,推荐,2012-06-28,4,"理性的光芒照耀自由的美国。
“现在当我们理性地去接近西方自由的度量衡时，才明白他们付诸了多少代价来平衡自由的天平，即便自由的承载物有时是沉重的死亡。”"
516197614,开膛手贝塔,推荐,2012-05-01,2,看到辛普森杀妻案，渐入佳境。刘瑜显然东施效颦了，虽然文字上比林达有趣，但林达夫妇这种娓娓道来的感觉自有一番力量：“那几本书看得我彻夜难眠，激动得在屋子里来回踱步。我相信每个人都有过这样的经历：忽然间，你看到了一束光。……我无法忘记他就像唠家常一样给我启蒙的时刻，我无法忘记那年冬天我蜷缩在被窝里读书的时刻，我无法忘记望着黑漆漆的夜空忍不住想哭的时刻。”王老板说的太离谱，但豁然开朗是真的。
61283302,猪头妖怪,推荐,2008-09-24,3,自由不意味着浪漫，意味着代价。
142484800,叶酱,力荐,2010-12-13,1,要是我们也像美国司法制度一样宁可错放而不是错判，可能会少几个赵作海和佘祥林吧~
578580701,summer,力荐,2012-09-09,2,作者太牛逼了，把一些枯燥乏味的东西写的浅显易懂又特别有趣，看的欲罢不能的。除了跟你讲解历史和文化背景，也表达了自己的观点，最重要的是还激发你从不同角度思考这些现象问题。感叹的是很多历史都是初高中学过但当时完全没深入思考过，妈的
1019989399,微我无酒,力荐,2016-03-11,2,自由之具象及其代价，米国制度真的太理想主义了…
38242535,熊阿姨,力荐,2008-06-29,1,我的美国宪政启蒙
1266853752,瑞Q,力荐,2017-11-05,1,一个中国人眼中的美国政治，窃以为是比托克维尔更好的西方政体启蒙读物。
404624223,小嗯肖央,力荐,2011-10-14,2,“在新闻自由这个问题上，如果忽略一些次要的问题和争执，将会对新闻自由形成最大威胁的，就是国家利益。”
569520490,wupeifan,推荐,2012-08-18,2,如果我在1999年前看这个书，可能很有触动。
561868788,[已注销],推荐,2012-07-29,2,200年前，打下江山后，美国的开国之父们忧虑一旦国家机器形成，将成为自行运转而人力难控的“怪兽”，因此，他们制定了一套宪法，名为《权利法案》，至今保护着美国人民的自由，和国家的民主。当然，人们也为这自由和民主，付出了很大很大的代价。本书是本系列后面3本书的一个大绪论，但不可或缺。本书后半部主要描述辛普森案件。
421100211,Wenqian Li,推荐,2011-08-02,2,正如林达在《历史深处的忧虑》一书中所写，与自由相伴的，往往是惨痛的代价。但热爱自由的人们，并不因此而选择“安全”，因为在他们看来，自由是人之存在的根本前提。自由、权利、尊严是不可让渡的。历史一再证明，那些一再放弃自由而选择暂时保障的人们，得到的往往只是镣铐。
344542686,戴莫卡,力荐,2011-01-24,1,受益良多
545198688,Hao,还行,2013-03-20,1,作者过于美化和简化一个国家
612250206,hybridmismatch,力荐,2013-11-16,2,十五封信 波波的推荐 我终于在上厕所、排队打饭、挤地铁和想念你的时候看完了 1.感觉比美国宪政史上的25个司法大案更深入浅出，一个辛普森案表达出很多2.挥别了读者意林上国内国外妄自菲薄的腔调，从现象到思维方式以及视角差别3.因为是波波推荐一定全五分……话说另一本新教与资本主义精神到现在还是hold不来
258036748,第五象限,力荐,2010-06-05,1,这套书最大的意义在于对于国人民主意识的启蒙性，即使是有质疑和反对，也带来了对于民主的思考，对于我们过去所谓的民主是一缕新风
551444916,泉の向日葵,力荐,2012-08-21,1,用生活说话。第一本主要探讨宪法及其修正案对美国民众产生的影响，很大篇幅是在讲辛普森案。斯蒂芬.潘弗所言：“如果你因为害怕一个不自由的时代，因此就不给他们言论自由的话，那么，这个不自由的时代已经开始了。是你自己给它开了头。”
157855668,容安,推荐,2009-10-11,1,自由需要勇气和能力。美国人有那个勇气和能力，此所谓民智。
1853195880,greenhands,推荐,2019-07-09,1,二十年前的作品，今日国人对美国的了解要比当时多，所以现在读来，就没有十年前读书中部分篇章时那种吸引的感觉了。
594315585,鹤少夜,力荐,2012-10-26,1,是好书，好多东西都是不知道的，有种被点醒的感觉。能让人比较有兴趣的去研究美国的运行机制，确实值得深思。
540936269,TimberNord,力荐,2012-06-06,1,非常不错，可能是林达所有书中最好的一本，关于辛普森案的叙述分析十分到位！基本上把美国司法的核心理念讲清楚了。
640226183,伊伊,力荐,2013-08-08,2,"笔者见到了一群自立自强、重视公益的美国人。美国人的自立自强，对当下“啃老”严重的大陆社会是一面很好的镜子。我们不要羡慕“富二代”、“官二代”，不要抱怨自己投错了胎，更不要问父母能为我们做些什么，而要问我们自己能做些什么，能为父母做些什么，能为他人和社会做些什么？
    美国向来被大陆教科书标为个人主义和金钱至上的资本主义社会。事实上，美国的个人主义并不排斥美国人对公益的重视，自立自强的美国人共同组成了一个看似松散实则强大的民间社会。相反，一向开口闭口集体主义的中国大陆，却真的是金钱至上，无视公益，而民间社会，几乎连草创都谈不上，遑论强大与否。言及于此，谁能不说我们所身处的这个社会相去真正的现代文明，还有一段很漫长的路要走呢？"
1118733775,爱读书的小柳柳,力荐,2016-12-11,2,如果你因为害怕一个不自由的时代，因此就不给他们言论自由的话，那么，这个不自由的时代已经开始了。是你自己给它开了头。美国是一个把公民自由看得高于一切的国家，但自由不是无偿的。如果没有这样的约束，一个聚集了巨大财富的美国政府，会迅速腐败下去，一个拥有强大权势的美国政府，会很容易地制造一些借口，轻易地拿走老百姓的那点自由。这是二百多年来，他们感到真正应该害怕的东西。
440140290,水长东,力荐,2011-09-27,1,明确了代价之后，仍然选择尊重公民的权利和自由为最高目标，这是需要勇气的。而且，有时候，甚至可以说，必须是有能力支付代价才能得到的。
363453442,傅踢踢,力荐,2011-03-09,1,我们总是用宏阔的概念去框定未知的世界，其实一个国家、一种制度，哪怕是一种可能性，最直观最有力的解释往往来自细节。在这个意义上，林达的这本书帮助普及了很多基本常识。更为可贵的是，这些基本常识是用例子来说的，一个好例子，抵得上多少长篇大论。
988467659,韦罗尼卡,还行,2015-12-18,1,曾今的科普现在的常识
269229645,陀思妥曼妥思,力荐,2010-08-07,1,自由实在不是什么罗曼蒂克的东西，这只不过是一种选择，是一个民族在明白了自由的全部含义，清醒的知道必须付出多少代价，测试过自己的承受能力之后，作出的一个选择。――林达
248171112,Moon,推荐,2010-05-07,1,拿年初的律师按和辛普森案比较，可以看出我国法律健全程度和美国差距不只1/4个世纪。提升社会道德的最好方式就是从自己做起，比起要求别人，劝进自己容易多了。
14164635,mike,null,2007-05-12,1,"我的民主启蒙教程,如果你现在还不知道goverment和administration的区别的话,可以读一读 :)"
178729151,猕猴桃,力荐,2009-11-15,1,看似杂陈热烈的五光十色下，却有一种高度的理性在统治和管理着这个国家。
38343606,安衍,力荐,2010-01-26,1,一部分同学被林达和蔼可亲的小桔灯语气搞得很没面子，非要强调一下――这是一本入门级读物！^_^
400998380,韬子@Tower,力荐,2011-06-09,1,某国不是洪水猛兽也不是人间天堂，它就是凡客。以上。
303944248,hiro,力荐,2010-11-11,0,这本书让人知道宪法在美国是多么神圣的东西  尽管美国自身还有很多问题，但是在没有法律的国家的人民看来 美国就是梦幻岛是佳离地，是Dream place。  本书最后一篇<t他们是美国人>里面生动地诠释了什么是美国梦的精髓。
73933324,七颗栗子,推荐,2008-11-20,0,美国梦
269781589,迷踪,力荐,2010-07-12,0,好书，深入浅出，通俗易懂，了解美国的入门书
1288184507,downtoearth,推荐,2017-12-18,1,二十多年前的美国观察了，放到现在基本还是鲜活的
188503788,恺音Kyin,力荐,2010-02-03,1,"founding fathers' wisdom, American FREEDOM "
301296519,饥饿艺术家,力荐,2010-10-06,0,逐渐读的深入才了解喂马叫《历史深处的忧虑》。以案件带动法律和体制，公平与正义，民主。祝，好！
110921040,南萧亭,推荐,2009-04-08,0,十年前读，把美国作为楷模。现在读，把美国作为需要了解的他者文化。不但对美国，对所有他者文化都要这样近距离的了解。
6794115,左思,力荐,2006-11-02,0,对美国有了一个较为真实的认识，尤其是陪审员制
285366671,上寅,力荐,2010-08-22,0,作者的观察和分析能力令人赞叹啊，作为一本好书，它的再版次数让我很欣慰。
9232110,薇_尼卡,力荐,2007-01-16,0,很喜欢，可惜现在书在他手里~
993850011,Pazaka,还行,2015-12-31,0,没有意料之外，所以只能说还行。
187008469,喜欢一个人,还行,2011-11-15,0,无感。。。
309898722,江南白衣,null,2010-10-31,0,近代几百年间，世上唯一一个可称圣的就是华盛顿吧，有点像老子笔下，就是因为他不认为自己是圣人，所以他成了圣人。
799874037,血源2出了吗？,推荐,2014-04-24,0,好看，燃
1035446923,不是很想说什么,力荐,2016-04-26,3,作者本身的文化底蕴决定了文字表达上非常流畅以及不失趣味性，加上对内容有条理的梳整，_(:з」∠)_终于懂为什么辣么多人推荐这套丛书做了解美帝法律入门惹，港真，这套丛书感觉也可以叫‘自由与自由的代价’。
464657422,亚细亚人,力荐,2011-12-02,1,逐条解析美国宪法修正案如何致力于保护每一个公民的合法权利不受任何机构（包括政府）和个人的损害。明明是介绍美国政治的书，却给我一种类似于宗教的启蒙。
337450011,小蛋蛋,力荐,2016-01-04,1,二十年前的书，现在看来仍具有科普价值。很精彩，结合美国律政剧的诠释，对美国的民主政治全貌有了了解，不得不惊叹，二百年前设计者的精心巧妙。
1004115196,不跑的云云,力荐,2016-03-25,1,再读，更明晰了一些东西，感触最深的与初次一般无二。立身之本于一个人一个国家都是一样的，更多时候明白最深处的根本，又深知需要付出的代价，而仍旧愿意坚守住，是最不容易做到的。
585472554,失控芭乐,力荐,2012-09-29,1,潘恩式人物。虽然只字未提常识的用意，但所谈的鲜活的美国制度已经让我浮想联翩。在社会凌驾于个人之上的观念下，某国若要改革不过是乌有乡里造空城。而林达所谈到三点，打通了我长久的困惑，即：自由是有代价的；言论自由与真理无关（反观某些公知）；国家法律是针对整体人民的。
437509574,溪流,力荐,2011-09-18,0,通俗易懂的普及读物
542092339,宗教理想娱乐,力荐,2012-06-09,1,面积和中国差不多，但对自由的定义及实践上却谬以千里。天朝的和谐社会，和谐掉的是公民理性思考后大部分发声的机会，消磨掉的是人们追求自由的决心。
631821878,甯,力荐,2015-03-02,1,《辛普森怎么引起了我的兴趣》、《公平才有看头》、《检察官输了》以及《世纪大审判的告诫》这几章真是激起自己对于美国司法热爱度的精彩内容！另外进一步引证了在美国这个成熟的体制下，人们可以根据自己的需求追求自己想要的生活，人与人之间存在真正的关心和照顾，并不用担心自己的人种不同而受到歧视，真正的自由是得到切实的保护的。如果想追求理想的生活，那里将是懂得奋斗懂得珍爱生活人的天堂。
660289281,Lovepeace,力荐,2013-03-29,1,通俗易懂。自由是一个选择，是一个民族在明白了自由的全部含义，清醒地知道必须付出多少代价，测试过自己的承受能力后，作出的一个选择。
830731900,流萤常寂光,推荐,2014-07-29,1,看到里面说美国立宪时为了防止百姓面对庞大的政府时处于弱势而设立的条款以及保护新闻自由言论自由的内容，不禁呵呵一笑大洋彼岸拼命防止预防的情况在贵国早就是社会常态了
535704780,光遐想,力荐,2012-05-24,1,与其说是介绍美国的文化，不如说是以书信的方式介绍美国的宪政制度与法治文化。这本小书里容纳了本科四年法学老师们所推崇和引介自由主义精神的真实运作。只是我们的法律在立法时往往大量抄袭西方的条文，可压根却又否定这些法律赖以生存的精神土壤：自由、民主和人权，真是一个悖论。
674990293,夕山,力荐,2013-07-26,1,开阔了眼界，增长了知识。大洋对岸那个国度，大家为自由付出的努力和承受的代价是我以前从未了解过的，真的很感动，那样的环境虽不完美，但心向往之。
1008237692,Karena,null,2016-02-12,1,"最近接连看了好几本美国政治制度和社会状态的书，有一种突然发现一片新大陆的感觉。自由不简单只是我们理解的想去哪儿去哪儿，想说什么说什么；正义也不仅仅是对奸淫掳掠的惩罚。不能说崇洋媚外，但是这个世界上不止有更先进的科学技术，的确有另一种更进步的文化和思想，对每一个独立人格意识形态的培养。

而早在两百多年前那片新大陆上就已经有人是这么在思考了。不得不说这个世界上真的存在天才，能够看到普通人看不到的东西。好比人们今天才检测到的引力波爱因斯坦早在100年前就预言到了一样。"
603639550,well,推荐,2014-09-21,2,其实本书开头已经说了，美国和中国截然不同。即使中国转向，我们也不会成为美国。有些部分理想化
586809178,雪莱,null,2012-10-03,1,毫无疑问作者对美国有理想主义的溢美 几乎很多例子都能找到反面  但你是认同有值得追求的某些价值追求 还是完全不信任何理想主义  这才是关键
527968703,烈,推荐,2012-05-04,1,这些第三世界的饥民啊，闻到隔壁家一点点民主法治味儿就大呼高明啊感天动地啊，什么时候能改变这残疾的局面...
29896196,丁萌,推荐,2008-01-28,0,基本在介绍新闻自由……
355625477,Mandolin,推荐,2011-04-19,0,还是不错滴。
482775309,so what,推荐,2012-01-15,0,20120114 很庆幸自己读了这本书 了解了很多 
758453797,久道,还行,2013-12-28,0,高中时读的，当时觉得不错。其实，林达的东西，没什么学理，基本是柿油小清新的调调。当然，其书在那个时代也有贡献。
207570475,八月槎,推荐,2010-01-25,0,怎么这么多读过的书没有标注？
709362354,Siyi,推荐,2013-10-10,0,不管是真是假，写得好看
180936750,国士,还行,2010-02-12,0,这本的内容和文笔要明显逊于《总统是靠不住的》和《我也有一个梦想》。
412934734,[已注销],还行,2011-07-11,0,近距x看米政治，主要f的是c。我X得林_的表_然很好，但是整本感X有c散，不像uf的那N好，一味的美降低的n次。要是前啄昕纯隙很入神的，可惜大多档闹R早已了然，lFe`。
482991542,几点小土,推荐,2012-01-16,0,感谢失眠
